{
  "schema_version": "logos.doctrine_marathon.resume-checkpoint.v3",
  "checkpoint_id": "DMV3-CP-0001",
  "created_at": "2026-08-27T19:00:00Z",
  "goal_digest": "sha256:0b4fe9528ca3b251d098e247471278e6fca35334fc32161d27e93ddcb2beab35",
  "prompt_digest": "sha256:494dfd574a257c99d03b84544343a94a05f678b4b08f19cac18f1ca31d80fd9d",
  "constitution_digest": "sha256:4d047e5280cb13d7d43cba20dbd6a35dcbaf1de0ad2c4f802da697a60b10befe",
  "campaign_digest": "sha256:08ad06379ce250cdf81a861337c40a07a9edae3ad2df5d4e01bcca951b8a2ab0",
  "event_ledger_digest": "sha256:32e3b1dfd997bc925b85e784e47b92ac69ef49b847db30ef840706e02b25d615",
  "dependency_graph_digest": "sha256:474a3b790228069175c1feb90cd26759e202718ad6aefbe0a00303fb0cb23702",
  "review_debt_digest": "sha256:01e2177807057b418da84412f9c4bcf0d37aea28927f745faff70f1c0d1757dc",
  "last_event_id": null,
  "next_ready_unit_ids": [],
  "blocking_gate_ids": [
    "FUTURE_RESEARCH_AUTHORITY",
    "SOURCE_INGESTION_AUTHORITY",
    "QUALIFIED_EXPERT_PACKS",
    "QUALIFIED_HUMAN_REVIEW"
  ],
  "fresh_context_due_at": "2026-09-03T19:00:00Z",
  "status": "BLOCKED"
}
